{
  "$schema": "https://json-schema.org/draft/2020-12/schema",
  "$id": "https://tony-football.local/architecture/graph.schema.json",
  "title": "Tony Football architecture graph",
  "type": "object",
  "required": ["schemaVersion", "title", "nodes", "edges", "summary"],
  "properties": {
    "schemaVersion": {"const": 1},
    "title": {"type": "string"},
    "sourceMap": {"type": "string"},
    "nodes": {
      "type": "array",
      "items": {
        "type": "object",
        "required": ["id", "label", "layer", "source", "owner", "role"],
        "properties": {
          "id": {"type": "string", "minLength": 1},
          "label": {"type": "string", "minLength": 1},
          "layer": {"type": "string", "minLength": 1},
          "source": {"type": "string", "minLength": 1},
          "owner": {"type": "string", "minLength": 1},
          "role": {"type": "string", "minLength": 1},
          "bridge": {"type": "object"}
        },
        "additionalProperties": true
      }
    },
    "edges": {
      "type": "array",
      "items": {
        "type": "object",
        "required": ["from", "to", "type"],
        "properties": {
          "from": {"type": "string"},
          "to": {"type": "string"},
          "type": {"type": "string"}
        },
        "additionalProperties": false
      }
    },
    "summary": {
      "type": "object",
      "required": ["nodeCount", "edgeCount", "layerCounts", "bridgeCount"]
    }
  },
  "additionalProperties": false
}