{"schemaVersion":1,"title":"Tony Football Architecture Graph","sourceMap":"docs/11_SOURCE_MAP.md","nodes":[{"id":"ApplicationRuntime","label":"ApplicationRuntime","layer":"application","source":"src/game/application/ApplicationRuntime.js","owner":"Application lifecycle","role":"Routes lifecycle commands and navigation requests."},{"id":"browser-entry.js","label":"browser-entry.js","layer":"browser","source":"browser-entry.js","owner":"Browser authority guard","role":"Sanitizes URL state before loading the deployed game composition."},{"id":"BrowserApplicationAdapter","label":"BrowserApplicationAdapter","layer":"application","source":"src/game/application/BrowserApplicationAdapter.js","owner":"Browser lifecycle adapter","role":"Binds browser buttons and immediate lifecycle UI projection."},{"id":"BrowserBootstrapComposition","label":"BrowserBootstrapComposition","layer":"application","source":"src/game/application/BrowserBootstrapComposition.js","owner":"Browser composition root","role":"Wires input, application, runtime, loop and presentation subscriptions."},{"id":"BrowserGameEventBridge","label":"BrowserGameEventBridge","layer":"presentation","source":"src/game/presentation/BrowserGameEventBridge.js","owner":"Event bridge","role":"Projects ordered immutable game events to browser consumers."},{"id":"BrowserInputAdapter","label":"BrowserInputAdapter","layer":"input","source":"src/game/input/BrowserInputAdapter.js","owner":"Input adapter","role":"Converts FO4 key lifecycle into immutable commands and attack intents."},{"id":"BrowserMatchRuntime","label":"BrowserMatchRuntime","layer":"application","source":"src/game/application/BrowserMatchRuntime.js","owner":"Browser engine wrapper","role":"Owns one MatchEngine and publishes immutable snapshots, events and intents."},{"id":"BrowserRuntimeComposition","label":"BrowserRuntimeComposition","layer":"application","source":"src/game/application/BrowserRuntimeComposition.js","owner":"Runtime composition","role":"Owns live runtime configuration and lifecycle routing."},{"id":"CompatibilitySnapshotAdapter","label":"CompatibilitySnapshotAdapter","layer":"presentation","source":"src/game/presentation/CompatibilitySnapshotAdapter.js","owner":"Snapshot migration bridge","role":"Projects immutable engine facts into temporary presentation mirrors.","bridge":{"issue":"TON-64","reason":"Remove legacy presentation mirrors"}},{"id":"FastCI","label":"Fast CI lane","layer":"tooling","source":".github/workflows/ci.yml","owner":"Required validation gate","role":"Runs browser-free engine, presentation, tooling and static build validation."},{"id":"game.js","label":"game.js","layer":"presentation","source":"game.js","owner":"Temporary presentation host","role":"Hosts remaining DOM, WebGL, Canvas and effect implementations pending TON-64.","bridge":{"issue":"TON-64","reason":"Presentation extraction"}},{"id":"GoalSequenceTimeline","label":"GoalSequenceTimeline","layer":"engine","source":"src/game/engine/GoalSequenceTimeline.js","owner":"Goal lifecycle authority","role":"Owns native highlight, cards, replay and kickoff phase order."},{"id":"HudSnapshotProjection","label":"HudSnapshotProjection","layer":"presentation","source":"src/game/presentation/HudSnapshotProjection.js","owner":"HUD projection","role":"Maps authoritative match facts into HUD values."},{"id":"index.html","label":"index.html","layer":"browser","source":"index.html","owner":"Browser shell","role":"Loads the guarded browser entry and never owns gameplay state."},{"id":"MatchEngine","label":"MatchEngine","layer":"engine","source":"src/game/engine/MatchEngine.js","owner":"Gameplay authority","role":"Single deterministic owner of players, ball, possession, AI, score, clock and lifecycle."},{"id":"RadarSnapshotRenderer","label":"RadarSnapshotRenderer","layer":"presentation","source":"src/game/presentation/RadarSnapshotRenderer.js","owner":"Radar renderer","role":"Draws radar state from immutable snapshots."},{"id":"ScenarioRunner","label":"ScenarioRunner","layer":"tests","source":"tests/scenarios/ScenarioRunner.mjs","owner":"Headless scenario harness","role":"Runs deterministic public-contract scenarios with compact traces."},{"id":"SimulationLoop","label":"SimulationLoop","layer":"core","source":"src/game/core/SimulationLoop.js","owner":"Core loop","role":"Runs fixed simulation updates and interpolated rendering."},{"id":"SnapshotCameraController","label":"SnapshotCameraController","layer":"presentation","source":"src/game/presentation/SnapshotCameraController.js","owner":"Camera projection","role":"Drives camera behavior from snapshots only."},{"id":"SnapshotRenderState","label":"SnapshotRenderState","layer":"presentation","source":"src/game/presentation/SnapshotRenderState.js","owner":"Render projection","role":"Interpolates immutable player and ball transforms."},{"id":"SnapshotReplayController","label":"SnapshotReplayController","layer":"presentation","source":"src/game/presentation/SnapshotReplayController.js","owner":"Replay projection","role":"Selects replay frames while the engine owns replay progress."}],"edges":[{"from":"ApplicationRuntime","to":"BrowserRuntimeComposition","type":"commands"},{"from":"browser-entry.js","to":"game.js","type":"loads"},{"from":"BrowserApplicationAdapter","to":"ApplicationRuntime","type":"commands"},{"from":"BrowserBootstrapComposition","to":"BrowserApplicationAdapter","type":"wires"},{"from":"BrowserBootstrapComposition","to":"BrowserInputAdapter","type":"wires"},{"from":"BrowserBootstrapComposition","to":"BrowserRuntimeComposition","type":"wires"},{"from":"BrowserBootstrapComposition","to":"CompatibilitySnapshotAdapter","type":"wires"},{"from":"BrowserBootstrapComposition","to":"SimulationLoop","type":"wires"},{"from":"BrowserGameEventBridge","to":"game.js","type":"renders"},{"from":"BrowserInputAdapter","to":"BrowserRuntimeComposition","type":"commands"},{"from":"BrowserMatchRuntime","to":"BrowserGameEventBridge","type":"events"},{"from":"BrowserMatchRuntime","to":"CompatibilitySnapshotAdapter","type":"snapshots"},{"from":"BrowserMatchRuntime","to":"MatchEngine","type":"owns"},{"from":"BrowserRuntimeComposition","to":"BrowserMatchRuntime","type":"owns"},{"from":"CompatibilitySnapshotAdapter","to":"HudSnapshotProjection","type":"projects"},{"from":"CompatibilitySnapshotAdapter","to":"RadarSnapshotRenderer","type":"projects"},{"from":"CompatibilitySnapshotAdapter","to":"SnapshotCameraController","type":"projects"},{"from":"CompatibilitySnapshotAdapter","to":"SnapshotRenderState","type":"projects"},{"from":"CompatibilitySnapshotAdapter","to":"SnapshotReplayController","type":"projects"},{"from":"FastCI","to":"game.js","type":"smoke-tests"},{"from":"FastCI","to":"ScenarioRunner","type":"runs"},{"from":"game.js","to":"BrowserBootstrapComposition","type":"wires"},{"from":"HudSnapshotProjection","to":"game.js","type":"renders"},{"from":"index.html","to":"browser-entry.js","type":"loads"},{"from":"MatchEngine","to":"BrowserMatchRuntime","type":"events"},{"from":"MatchEngine","to":"BrowserMatchRuntime","type":"snapshots"},{"from":"MatchEngine","to":"GoalSequenceTimeline","type":"owns"},{"from":"RadarSnapshotRenderer","to":"game.js","type":"renders"},{"from":"ScenarioRunner","to":"MatchEngine","type":"tests"},{"from":"SimulationLoop","to":"BrowserRuntimeComposition","type":"ticks"},{"from":"SnapshotCameraController","to":"game.js","type":"renders"},{"from":"SnapshotRenderState","to":"game.js","type":"renders"},{"from":"SnapshotReplayController","to":"game.js","type":"renders"}],"summary":{"nodeCount":21,"edgeCount":33,"layerCounts":{"browser":2,"application":5,"input":1,"core":1,"engine":2,"presentation":8,"tests":1,"tooling":1,"assets":0,"external":0},"bridgeCount":2}}
